<?xml version="1.0" encoding="UTF-8"?>
<?xml-stylesheet type="text/xsl" href="books.xsl"?>
<!DOCTYPE bookshop SYSTEM "bookshop.dtd">

<bookshop>
    <book id="b1">
        <title>The Mountain Is You</title>
        <author>Brianna Wiest</author>
        <genre>Self-Help / Psychology</genre>
        <price>750.00</price>
        <year>2020</year>
        <isbn>978-0-306-40600-7</isbn>
        <quantity>10</quantity>
        <image>images/the-mountain-is-you.png</image>
        <link>../contact.html</link>
        <description>This is a book about self-sabotage. Why we do it, when we do it, and how to stop doing it—for good. Coexisting but conflicting needs create self-sabotaging behaviors. This is why we resist efforts to change, often until they feel completely futile. But by extracting crucial insight from our most damaging habits, building emotional intelligence by better understanding our brains and bodies, releasing past experiences at a cellular level, and learning to act as our highest potential future selves, we can step out of our own way and into our potential. For centuries, the mountain has been used as a metaphor for the big challenges we face, especially ones that seem impossible to overcome. To scale our mountains, we actually have to do the deep internal work of excavating trauma, building resilience, and adjusting how we show up for the climb. In the end, it is not the mountain we master, but ourselves.</description>
    </book>
    
    <book id="b2">
        <title>Atomic Habits</title>
        <author>James Clear</author>
        <genre>Self-Help / Psychology</genre>
        <price>935.00</price>
        <year>2018</year>
        <isbn>978-0-306-40601-7</isbn>
        <quantity>18</quantity>
        <image>images/atomic-habits.jpg</image>
        <link>../contact.html</link>
        <description>No matter your goals, Atomic Habits offers a proven framework for improving—every day. James Clear, one of the world's leading experts on habit formation, reveals practical strategies that will teach you exactly how to form good habits, break bad ones, and master the tiny behaviors that lead to remarkable results.</description>
    </book>
    
    <book id="b3">
        <title>The Psychology Of Money</title>
        <author>Morgan Housel</author>
        <genre>Self-Help / Psychology</genre>
        <price>1501.50</price>
        <year>2020</year>
        <isbn>978-0-306-40602-7</isbn>
        <quantity>20</quantity>
        <image>images/the-psychology-of-money.jpg</image>
        <link>../contact.html</link>
        <description>Doing well with money isn’t necessarily about what you know. It’s about how you behave. And behavior is hard to teach, even to really smart people. In The Psychology of Money, award-winning author Morgan Housel shares 19 short stories exploring the different ways people think about money and teaches you how to make better sense of one of life’s most important topics.</description>
    </book>
    
    <book id="b4">
        <title>The Let Them Theory</title>
        <author>Mel Robbins</author>
        <genre>Self-Help / Psychology</genre>
        <price>1260.05</price>
        <year>2024</year>
        <isbn>978-0-306-40603-7</isbn>
        <quantity>22</quantity>
        <image>images/the-let-them-theory.jpg</image>
        <link>../contact.html</link>
        <description>If you've ever felt stuck, overwhelmed, or frustrated with where you are, the problem isn't you. The problem is the power you give to other people. Two simple words—Let Them—will set you free. Free from the opinions, drama, and judgments of others. Free from the exhausting cycle of trying to manage everything and everyone around you. The Let Them Theory puts the power to create a life you love back in your hands—and this book will show you exactly how to do it.</description>
    </book>
    
    <book id="b5">
        <title>The Subtle Art Of Not Giving A F*ck</title>
        <author>Mark Manson</author>
        <genre>Self-Help / Psychology</genre>
        <price>1300.00</price>
        <year>2016</year>
        <isbn>978-0-306-40604-7</isbn>
        <quantity>10</quantity>
        <image>images/the-subtle-art-of-not-giving-a-fuck.jpg</image>
        <link>../contact.html</link>
        <description>There are only so many things we can give a f**k about so we need to figure out which ones really matter, Manson makes clear. While money is nice, caring about what you do with your life is better, because true wealth is about experience. A much-needed grab-you-by-the-shoulders-and-look-you-in-the-eye moment of real-talk, filled with entertaining stories and profane, ruthless humor, The Subtle Art of Not Giving a F**k is a refreshing slap for a generation to help them lead contented, grounded lives.</description>
    </book>
    
    <book id="b6">
        <title>Ikigai</title>
        <author>Héctor García and Francesc Miralles</author>
        <genre>Self-Help / Psychology</genre>
        <price>550</price>
        <year>2016</year>
        <isbn>978-0-306-40605-7</isbn>
        <quantity>12</quantity>
        <image>images/ikigai.jpg</image>
        <link>../contact.html</link>
        <description>According to the Japanese, everyone has an ikigai—a reason for living. And according to the residents of the Japanese village with the world’s longest-living people, finding it is the key to a happier and longer life. Having a strong sense of ikigai—where what you love, what you’re good at, what you can get paid for, and what the world needs all overlap—means that each day is infused with meaning. It’s the reason we get up in the morning. It’s also the reason many Japanese never really retire: they remain active and work at what they enjoy, because they’ve found a real purpose in life.</description>
    </book>
    
    <book id="b7">
        <title>Everything Is F*cked</title>
        <author>Mark Manson</author>
        <genre>Self-Help / Psychology</genre>
        <price>1550</price>
        <year>2019</year>
        <isbn>978-0-306-40606-7</isbn>
        <quantity>11</quantity>
        <image>images/everything-is-fucked.png</image>
        <link>../contact.html</link>
        <description>In Everything Is F*cked, Manson turns his gaze from the inevitable flaws within each individual self to the endless calamities taking place in the world around us. Drawing from psychological research and philosophy, he examines faith, happiness, freedom, hope, money, entertainment, and the internet.</description>
    </book>
    
    <book id="b8">
        <title>The Silent Patient</title>
        <author>Alex Michaelides</author>
        <genre>Mystery</genre>
        <price>900.00</price>
        <year>2019</year>
        <isbn>978-0-306-40607-7</isbn>
        <quantity>14</quantity>
        <image>images/the_silent_patient.jpg</image>
        <link>../contact.html</link>
        <description>Theo Faber is a criminal psychotherapist who has waited a long time for the opportunity to work with Alicia. His determination to get her to talk and unravel the mystery of why she shot her husband takes him down a twisting path into his own motivations—a search for the truth that threatens to consume him.</description>
    </book>
    
    <book id="b9">
        <title>A Good Girl's Guide To Murder</title>
        <author>Holly Jackson</author>
        <genre>Mystery</genre>
        <price>600.00</price>
        <year>2019</year>
        <isbn>978-0-306-40608-7</isbn>
        <quantity>8</quantity>
        <image>images/a-good-girls-guide-to-murder.jpg</image>
        <link>../contact.html</link>
        <description>The case is closed. Five years ago, schoolgirl Andie Bell was murdered by Sal Singh. The police know he did it. Everyone in town knows he did it. But Pippa Fitz-Amobi isn't so sure. When she chooses the case as the topic for her final project, she starts to uncover secrets that someone in town desperately wants to stay hidden.</description>
    </book>
    
    <book id="b10">
        <title>Good Girl, Bad Blood</title>
        <author>Holly Jackson</author>
        <genre>Mystery</genre>
        <price>650.00</price>
        <year>2020</year>
        <isbn>978-0-306-40609-7</isbn>
        <quantity>15</quantity>
        <image>images/good-girl-bad-blood.jpg</image>
        <link>../contact.html</link>
        <description>Pip is not a detective anymore. Yet when someone she knows goes missing, she has to break that promise. Jamie Reynolds has disappeared, and the police won't do anything about it. Pip uncovers more of her town's dark secrets, and this time everyone is listening.</description>
    </book>
    
    <book id="b11">
        <title>One Of Us Is Lying</title>
        <author>Karen M. McManus</author>
        <genre>Mystery</genre>
        <price>740.00</price>
        <year>2017</year>
        <isbn>978-0-306-40610-7</isbn>
        <quantity>19</quantity>
        <image>images/one-of-us-is-lying.jpg</image>
        <link>../contact.html</link>
        <description>Five students walk into detention. Only four walk out alive. Simon, the creator of Bayview High's notorious gossip app, dies before the end of detention, and all four classmates become suspects in his murder. Everyone has secrets. What matters is how far you would go to protect them.</description>
    </book>
    
    <book id="b12">
        <title>We Were Liars</title>
        <author>E. Lockhart</author>
        <genre>Mystery</genre>
        <price>450.00</price>
        <year>2014</year>
        <isbn>978-0-306-40611-7</isbn>
        <quantity>12</quantity>
        <image>images/we-were-liars.jpg</image>
        <link>../contact.html</link>
        <description>A beautiful and distinguished family. A private island. A brilliant, damaged girl. A group of four friends—the Liars—whose friendship turns destructive. A secret. Lies upon lies. True love. The truth.</description>
    </book>
    
    <book id="b13">
        <title>Fearless</title>